<?xml version="1.0" encoding="UTF-8"?>
<simulation xmlns:xsi="http://www.w3.org/2001/XMLSchema-instance"
            xsi:noNamespaceSchemaLocation="input.xsd">
    <metadata>
        <container>
            <directSum/>
        </container>
        <force>
            <Gravity/>
        </force>
        <delta_t>0.014</delta_t>
        <t_end>10</t_end>
        <twoD>true</twoD>
    </metadata>
    <cuboids>
        <cuboid>
            <velocity>
                <x>0.0</x>
                <y>0.0</y>
                <z>0.0</z>
            </velocity>
            <corner>
                <x>0.0</x>
                <y>0.0</y>
                <z>0.0</z>
            </corner>
            <dimensions>
                <x>1</x>
                <y>1</y>
                <z>1</z>
            </dimensions>
            <type>1</type>
            <h>0.0</h>
            <mass>1.0</mass>
            <epsilon>0.0</epsilon>
            <sigma>0.0</sigma>
            <mv>0.0</mv>
            <!--<twoD>false</twoD>-->
        </cuboid>
        <cuboid>
            <velocity>
                <x>-1.0</x>
                <y>0.0</y>
                <z>0.0</z>
            </velocity>
            <corner>
                <x>0.0</x>
                <y>1.0</y>
                <z>0.0</z>
            </corner>
            <dimensions>
                <x>1</x>
                <y>1</y>
                <z>1</z>
            </dimensions>
            <type>2</type>
            <h>0.0</h>
            <mass>0.000003</mass>
            <epsilon>0.0</epsilon>
            <sigma>0.0</sigma>
            <mv>0.0</mv>
            <!--<twoD>false</twoD>-->
        </cuboid>
        <cuboid>
            <velocity>
                <x>-0.425</x>
                <y>0.0</y>
                <z>0.0</z>
            </velocity>
            <corner>
                <x>0.0</x>
                <y>5.36</y>
                <z>0.0</z>
            </corner>
            <dimensions>
                <x>1</x>
                <y>1</y>
                <z>1</z>
            </dimensions>
            <type>3</type>
            <h>0.0</h>
            <mass>0.000955</mass>
            <epsilon>0.0</epsilon>
            <sigma>0.0</sigma>
            <mv>0.0</mv>
            <!--<twoD>false</twoD>-->
        </cuboid>
        <cuboid>
            <velocity>
                <x>0.0</x>
                <y>0.0296</y>
                <z>0.0</z>
            </velocity>
            <corner>
                <x>34.75</x>
                <y>0.0</y>
                <z>0.0</z>
            </corner>
            <dimensions>
                <x>1</x>
                <y>1</y>
                <z>1</z>
            </dimensions>
            <type>4</type>
            <h>0.0</h>
            <mass>0.00000000000001</mass>
            <epsilon>0.0</epsilon>
            <sigma>0.0</sigma>
            <mv>0.0</mv>
            <!--<twoD>false</twoD>-->
        </cuboid>
    </cuboids>
</simulation>
