<?xml version="1.0"?>
<simulation xmlns:xsi="http://www.w3.org/2001/XMLSchema-instance"
            xsi:noNamespaceSchemaLocation="input.xsd">
    <metadata>
        <container>
            <linkedCells>
                <domain>
                    <x>400</x>
                    <y>400</y>
                    <z>1</z>
                </domain>
                <r_cutoff>3.0</r_cutoff>
                <boundary>
                    <x_high>
                        <Outflow/>
                    </x_high>
                    <x_low>
                        <Outflow/>
                    </x_low>
                    <y_high>
                        <Outflow/>
                    </y_high>
                    <y_low>
                        <Outflow/>
                    </y_low>
                    <z_high>
                        <Outflow/>
                    </z_high>
                    <z_low>
                        <Outflow/>
                    </z_low>
                </boundary>
            </linkedCells>
        </container>
        <force>
            <LennardJones/>
        </force>
        <delta_t>0.015</delta_t>
        <t_end>15</t_end>
        <twoD>false</twoD>
    </metadata>
    <cuboids>
        <cuboid>
            <velocity>
                <x>0.0</x>
                <y>0.0</y>
                <z>0.0</z>
            </velocity>
            <corner>
                <x>0.0</x>
                <y>0.0</y>
                <z>0.0</z>
            </corner>
            <dimensions>
                <x>10</x>
                <y>10</y>
                <z>10</z>
            </dimensions>
            <type>1</type>
            <h>1.1225</h>
            <mass>5.0</mass>
            <epsilon>0.1</epsilon>
            <sigma>0.2</sigma>
            <mv>0.3</mv>
        </cuboid>
    </cuboids>
    <spheroids>
        <spheroid>
            <velocity>
                <x>0.0</x>
                <y>0.0</y>
                <z>0.0</z>
            </velocity>
            <origin>
                <x>15.0</x>
                <y>15.0</y>
                <z>15.0</z>
            </origin>
            <radius>5</radius>
            <type>2</type>
            <h>1.1225</h>
            <mass>3.0</mass>
            <epsilon>5</epsilon>
            <sigma>1</sigma>
            <mv>0.1</mv>
        </spheroid>
    </spheroids>
</simulation>
