<?xml version="1.0"?>
<simulation xmlns:xsi="http://www.w3.org/2001/XMLSchema-instance"
            xsi:noNamespaceSchemaLocation="input.xsd">
    <metadata>
        <container>
            <linkedCells>
                <domain>
                    <x>290</x>
                    <y>290</y>
                    <z>200</z>
                </domain>
                <r_cutoff>3.0</r_cutoff>
                <boundary>
                    <Boundary/>
                </boundary>
            </linkedCells>
        </container>
        <force>
            <LennardJones/>
        </force>
        <delta_t>0.0002</delta_t>
        <t_end>5</t_end>
        <twoD>true</twoD>
    </metadata>
    <cuboids>
        <cuboid>
            <velocity>
                <x>0.0</x>
                <y>0.0</y>
                <z>0.0</z>
            </velocity>
            <corner>
                <x>0.0</x>
                <y>0.0</y>
                <z>0.0</z>
            </corner>
            <dimensions>
                <x>40</x>
                <y>8</y>
                <z>1</z>
            </dimensions>
            <type>1</type>
            <h>1.1225</h>
            <mass>1.0</mass>
            <epsilon>5.0</epsilon>
            <sigma>1.0</sigma>
            <mv>0.1</mv>
        </cuboid>
        <cuboid>
            <velocity>
                <x>0.0</x>
                <y>-10.0</y>
                <z>0.0</z>
            </velocity>
            <corner>
                <x>15</x>
                <y>15</y>
                <z>0.0</z>
            </corner>
            <dimensions>
                <x>8</x>
                <y>8</y>
                <z>1</z>
            </dimensions>
            <type>2</type>
            <h>1.1225</h>
            <mass>1.0</mass>
            <epsilon>5.0</epsilon>
            <sigma>1.0</sigma>
            <mv>0.1</mv>
        </cuboid>
    </cuboids>

</simulation>
