<?xml version="1.0"?>
<simulation xmlns:xsi="http://www.w3.org/2001/XMLSchema-instance"
            xsi:noNamespaceSchemaLocation="input.xsd">
    <metadata delta_t="0.00005" t_end="10" r_cutoff="3.0">
        <domain>
            <x>120</x>
            <y>50</y>
            <z>1</z>
        </domain>
    </metadata>
    <spheroids>
        <spheroid>
            <velocity>
                <x>0.0</x>
                <y>-10</y>
                <z>0.0</z>
            </velocity>
            <origin>
                <x>60</x>
                <y>25</y>
                <z>0</z>
            </origin>
            <radius>15</radius>
            <type>2</type>
            <h>1.1225</h>
            <mass>1.0</mass>
            <epsilon>5</epsilon>
            <sigma>1</sigma>
            <twoD>true</twoD>
        </spheroid>
    </spheroids>
</simulation>
