<?xml version="1.0"?>
<simulation xmlns:xsi="http://www.w3.org/2001/XMLSchema-instance"
            xsi:noNamespaceSchemaLocation="input.xsd">
    <metadata>
        <container>
            <linkedCells>
                <domain>
                    <x>120</x>
                    <y>50</y>
                    <z>1</z>
                </domain>
                <r_cutoff>3.0</r_cutoff>
                <boundary>
                    <x_high>
                        <Reflective/>
                    </x_high>
                    <x_low>
                        <Reflective/>
                    </x_low>
                    <y_high>
                        <Reflective/>
                    </y_high>
                    <y_low>
                        <Reflective/>
                    </y_low>
                    <z_high>
                        <Outflow/>
                    </z_high>
                    <z_low>
                        <Outflow/>
                    </z_low>
                </boundary>
            </linkedCells>
        </container>
        <force>
            <LennardJones/>
        </force>
        <delta_t>0.00005</delta_t>
        <t_end>10</t_end>
        <twoD>true</twoD>
    </metadata>
    <spheroids>
        <spheroid>
            <velocity>
                <x>0.0</x>
                <y>-10</y>
                <z>0.0</z>
            </velocity>
            <origin>
                <x>60</x>
                <y>25</y>
                <z>0</z>
            </origin>
            <radius>15</radius>
            <type>2</type>
            <h>1.1225</h>
            <mass>1.0</mass>
            <epsilon>5</epsilon>
            <sigma>1</sigma>
            <mv>0.0</mv>
        </spheroid>
    </spheroids>
</simulation>
