<?xml version="1.0"?>
<simulation xmlns:xsi="http://www.w3.org/2001/XMLSchema-instance"
            xsi:noNamespaceSchemaLocation="input.xsd">
    <metadata delta_t="0.0005" t_end="20" r_cutoff="3.0">
        <domain>
            <x>100</x>
            <y>100</y>
            <z>10</z>
        </domain>
    </metadata>
    <cuboids>
        <cuboid>
            <velocity>
                <x>0.0</x>
                <y>0.0</y>
                <z>0.0</z>
            </velocity>
            <corner>
                <x>1</x>
                <y>1</y>
                <z>1</z>
            </corner>
            <dimensions>
                <x>46</x>
                <y>46</y>
                <z>1</z>
            </dimensions>
            <type>1</type>
            <h>1.1225</h>
            <mass>1.0</mass>
            <epsilon>5.0</epsilon>
            <sigma>1.0</sigma>
            <mv>0.1</mv>
            <twoD>true</twoD>
        </cuboid>
    </cuboids>
</simulation>
