<?xml version="1.0"?>
<simulation xmlns:xsi="http://www.w3.org/2001/XMLSchema-instance"
            xsi:noNamespaceSchemaLocation="input.xsd">
    <metadata>
        <container>
            <linkedCells>
                <domain>
                    <x>30</x>
                    <y>30</y>
                    <z>12</z>
                </domain>
                <r_cutoff>2.75</r_cutoff>
                <boundary>
                    <x_high>
                        <Outflow/>
                    </x_high>
                    <x_low>
                        <Outflow/>
                    </x_low>
                    <y_high>
                        <Periodic/>
                    </y_high>
                    <y_low>
                        <Periodic/>
                    </y_low>
                    <z_high>
                        <Periodic/>
                    </z_high>
                    <z_low>
                        <Periodic/>
                    </z_low>
                </boundary>
            </linkedCells>
        </container>
        <force>
            <LennardJones/>
            <SingularGravity g="-0.8"/>
        </force>
        <delta_t>0.0005</delta_t>
        <t_end>10</t_end>
        <twoD>false</twoD>
        <statistics>
            <x_bins>50</x_bins>
            <y_bins>1</y_bins>
            <output_interval>10000</output_interval>
        </statistics>
    </metadata>
    <cuboids>
        <cuboid>
            <velocity>
                <x>0</x>
                <y>0</y>
                <z>0</z>
            </velocity>
            <corner>
                <x>1.0</x>
                <y>0.5</y>
                <z>0.5</z>
            </corner>
            <dimensions>
                <x>2</x>
                <y>30</y>
                <z>12</z>
            </dimensions>
            <type>-1</type>
            <h>1.0</h>
            <mass>1.0</mass>
            <epsilon>2.0</epsilon>
            <sigma>1.1</sigma>
            <mv>0.0</mv>
        </cuboid>
        <cuboid>
            <velocity>
                <x>0.0</x>
                <y>0.0</y>
                <z>0.0</z>
            </velocity>
            <corner>
                <x>27.2</x>
                <y>0.5</y>
                <z>0.5</z>
            </corner>
            <dimensions>
                <x>2</x>
                <y>30</y>
                <z>12</z>
            </dimensions>
            <type>-2</type>
            <h>1.0</h>
            <mass>1.0</mass>
            <epsilon>2.0</epsilon>
            <sigma>1.1</sigma>
            <mv>0.0</mv>
        </cuboid>
        <cuboid>
            <velocity>
                <x>0.0</x>
                <y>0.0</y>
                <z>0.0</z>
            </velocity>
            <corner>
                <x>3.2</x>
                <y>0.6</y>
                <z>0.6</z>
            </corner>
            <dimensions>
                <x>20</x>
                <y>25</y>
                <z>10</z>
            </dimensions>
            <type>1</type>
            <h>1.2</h>
            <mass>1.0</mass>
            <epsilon>1.0</epsilon>
            <sigma>1.0</sigma>
            <mv>0.0</mv>
        </cuboid>
    </cuboids>
    <thermostat>
        <T_init>40</T_init>
        <n_thermostat>10</n_thermostat>
        <use_thermal_motion>true</use_thermal_motion>
    </thermostat>
</simulation>
