<?xml version="1.0"?>
<simulation xmlns:xsi="http://www.w3.org/2001/XMLSchema-instance"
            xsi:noNamespaceSchemaLocation="input.xsd">
    <metadata>
        <container>
            <linkedCells>
                <domain>
                    <x>63</x>
                    <y>36</y>
                    <z>1</z>
                </domain>
                <r_cutoff>2.5</r_cutoff>
                <boundary>
                    <x_high>
                        <Reflective/>
                    </x_high>
                    <x_low>
                        <Reflective/>
                    </x_low>
                    <y_high>
                        <Reflective/>
                    </y_high>
                    <y_low>
                        <Reflective/>
                    </y_low>
                    <z_high>
                        <Outflow/>
                    </z_high>
                    <z_low>
                        <Outflow/>
                    </z_low>
                </boundary>
            </linkedCells>
        </container>
        <force>
            <LennardJones/>
            <SingularGravity g="-12.44"/>
        </force>
        <delta_t>0.0005</delta_t>
        <t_end>25</t_end>
        <twoD>true</twoD>
    </metadata>
    <cuboids>
        <cuboid>
            <velocity>
                <x>0.0</x>
                <y>0.0</y>
                <z>0.0</z>
            </velocity>
            <corner>
                <x>0.6</x>
                <y>2</y>
                <z>0</z>
            </corner>
            <dimensions>
                <x>50</x>
                <y>14</y>
                <z>1</z>
            </dimensions>
            <type>1</type>
            <h>1.2</h>
            <mass>1.0</mass>
            <epsilon>1.0</epsilon>
            <sigma>1.0</sigma>
            <mv>0.1</mv>
        </cuboid>
        <cuboid>
            <velocity>
                <x>0</x>
                <y>0</y>
                <z>0</z>
            </velocity>
            <corner>
                <x>0.6</x>
                <y>19</y>
                <z>0</z>
            </corner>
            <dimensions>
                <x>50</x>
                <y>14</y>
                <z>1</z>
            </dimensions>
            <type>2</type>
            <h>1.2</h>
            <mass>2.0</mass>
            <epsilon>1.0</epsilon>
            <sigma>0.9412</sigma>
            <mv>0.1</mv>
        </cuboid>
    </cuboids>

</simulation>