<?xml version="1.0"?>
<simulation xmlns:xsi="http://www.w3.org/2001/XMLSchema-instance"
            xsi:noNamespaceSchemaLocation="input.xsd">
    <metadata>
        <container>
            <linkedCells>
                <domain>
                    <x>148</x>
                    <y>148</y>
                    <z>148</z>
                </domain>
                <r_cutoff>4.0</r_cutoff>
                <boundary>
                    <x_high>
                        <Outflow/>
                    </x_high>
                    <x_low>
                        <Outflow/>
                    </x_low>
                    <y_high>
                        <Outflow/>
                    </y_high>
                    <y_low>
                        <Outflow/>
                    </y_low>
                    <z_high>
                        <Reflective/>
                    </z_high>
                    <z_low>
                        <Reflective/>
                    </z_low>
                </boundary>
            </linkedCells>
        </container>
        <force>
            <LennardJones/>
            <HarmonicForce>
                <r_0>2.2</r_0>
                <k>300</k>
            </HarmonicForce>
            <IndexForce>
                <index>
                    <x>14</x>
                    <y>14</y>
                    <z>1</z>
                </index>
                <time>50</time>
                <force_values>
                    <x>1</x>
                    <y>1</y>
                    <z>1</z>
                </force_values>
            </IndexForce>
        </force>
        <delta_t>0.01</delta_t>
        <t_end>500</t_end>
        <twoD>false</twoD>
    </metadata>
    <membranes>
        <membrane>
            <velocity>
                <x>0</x>
                <y>0</y>
                <z>0</z>
            </velocity>
            <corner>
                <x>15</x>
                <y>15</y>
                <z>1.5</z>
            </corner>
            <dimensions>
                <x>50</x>
                <y>50</y>
                <z>1</z>
            </dimensions>
            <type>1</type>
            <h>2.2</h>
            <mass>1.0</mass>
            <epsilon>1.0</epsilon>
            <sigma>1.0</sigma>
            <mv>0.0</mv>
        </membrane>
    </membranes>
</simulation>
