<?xml version="1.0"?>
<simulation xmlns:xsi="http://www.w3.org/2001/XMLSchema-instance"
            xsi:noNamespaceSchemaLocation="../input/input.xsd">
    <metadata>
        <container>
            <directSum/>
        </container>
        <force>
            <LennardJones/>
        </force>
        <delta_t>0.015</delta_t>
        <t_end>15</t_end>
        <twoD>true</twoD>
    </metadata>
    <cuboids>
        <cuboid>
            <velocity>
                <x>0.0</x>
                <y>0.0</y>
                <z>0.0</z>
            </velocity>
            <corner>
                <x>1</x>
                <y>1</y>
                <z>1</z>
            </corner>
            <dimensions>
                <x>10</x>
                <y>2</y>
                <z>1</z>
            </dimensions>
            <type>1</type>
            <h>1.1225</h>
            <mass>5.0</mass>
            <epsilon>0.1</epsilon>
            <sigma>0.2</sigma>
            <mv>0.0</mv>
        </cuboid>
    </cuboids>
    <thermostat>
        <T_init>1.0</T_init>
        <n_thermostat>100</n_thermostat>
        <T_target>10.0</T_target>
        <deltaT>2.0</deltaT>
    </thermostat>
</simulation>
