<?xml version="1.0"?>
<simulation xmlns:xsi="http://www.w3.org/2001/XMLSchema-instance"
            xsi:noNamespaceSchemaLocation="input.xsd">
    <metadata>
        <container>
            <linkedCells>
                <domain>
                    <x>303</x>
                    <y>180</y>
                    <z>1</z>
                </domain>
                <r_cutoff>3.0</r_cutoff>
                <boundary>
                    <x_high>
                        <Reflective/>
                    </x_high>
                    <x_low>
                        <Reflective/>
                    </x_low>
                    <y_high>
                        <Reflective/>
                    </y_high>
                    <y_low>
                        <Reflective/>
                    </y_low>
                    <z_high>
                        <Outflow/>
                    </z_high>
                    <z_low>
                        <Outflow/>
                    </z_low>
                </boundary>
            </linkedCells>
        </container>
        <force>
            <LennardJones/>
            <SingularGravity g="-12.44"/>
        </force>
        <delta_t>0.0005</delta_t>
        <t_end>15</t_end>
        <twoD>true</twoD>
        <checkpoint>../scripts/output/test.xml</checkpoint>
    </metadata>
    <spheroids>
        <spheroid>
            <velocity>
                <x>0.0</x>
                <y>0.0</y>
                <z>0.0</z>
            </velocity>
            <origin>
                <x>150</x>
                <y>150</y>
                <z>0</z>
            </origin>
            <radius>20</radius>
            <type>2</type>
            <h>1.2</h>
            <mass>1.0</mass>
            <epsilon>1.0</epsilon>
            <sigma>1.0</sigma>
            <mv>0.0</mv>
        </spheroid>
    </spheroids>
</simulation>
