<?xml version="1.0"?>
<simulation xmlns:xsi="http://www.w3.org/2001/XMLSchema-instance"
            xsi:noNamespaceSchemaLocation="input.xsd">
    <!-- THIS DOES NOT WORK YET -->
    <metadata>
        <container>
            <linkedCells>
                <domain>
                    <x>500</x>
                    <y>500</y>
                    <z>500</z>
                </domain>
                <r_cutoff>8.5</r_cutoff>
                <boundary>
                    <north>
                        <Reflective/>
                    </north>
                    <south>
                        <Reflective/>
                    </south>
                    <east>
                        <Reflective/>
                    </east>
                    <west>
                        <Reflective/>
                    </west>
                    <up>
                        <Reflective/>
                    </up>
                    <down>
                        <Reflective/>
                    </down>
                </boundary>
            </linkedCells>
        </container>
        <force>
            <LennardJones/>
        </force>
        <delta_t>0.001</delta_t>
        <t_end>20</t_end>
        <twoD>false</twoD>
    </metadata>
    <cuboids>
        <cuboid>
            <velocity>
                <x>0.0</x>
                <y>0.0</y>
                <z>0.0</z>
            </velocity>
            <corner>
                <x>20</x>
                <y>20</y>
                <z>20</z>
            </corner>
            <dimensions>
                <x>30</x>
                <y>30</y>
                <z>15</z>
            </dimensions>
            <type>1</type>
            <h>1.1225</h>
            <mass>100</mass>
            <epsilon>120</epsilon>
            <sigma>3.4</sigma>
            <mv>0</mv>
        </cuboid>
        <cuboid>
            <velocity>
                <x>0</x>
                <y>0</y>
                <z>20.4</z>
            </velocity>
            <corner>
                <x>30</x>
                <y>30</y>
                <z>10</z>
            </corner>
            <dimensions>
                <x>10</x>
                <y>10</y>
                <z>10</z>
            </dimensions>
            <type>2</type>
            <h>1.1225</h>
            <mass>100</mass>
            <epsilon>120</epsilon>
            <sigma>3.4</sigma>
            <mv>0</mv>
        </cuboid>
    </cuboids>

</simulation>