<?xml version="1.0"?>
<simulation xmlns:xsi="http://www.w3.org/2001/XMLSchema-instance"
            xsi:noNamespaceSchemaLocation="input.xsd">
    <metadata>
        <container>
            <linkedCells>
                <domain>
                    <x>60</x>
                    <y>60</y>
                    <z>60</z>
                </domain>
                <r_cutoff>3.6</r_cutoff>
                <boundary>
                    <x_high>
                        <Outflow></Outflow>
                    </x_high>
                    <x_low>
                        <Outflow></Outflow>
                    </x_low>
                    <y_high>
                        <Outflow></Outflow>
                    </y_high>
                    <y_low>
                        <Outflow></Outflow>
                    </y_low>
                    <z_high>
                        <Periodic></Periodic>
                    </z_high>
                    <z_low>
                        <Periodic></Periodic>
                    </z_low>
                </boundary>
            </linkedCells>
        </container>
        <force>
            <LennardJones/>
            <SingularGravity>
                <g>-12.44</g>
                <axis>1</axis>
            </SingularGravity>
        </force>
        <delta_t>0.0005</delta_t>
        <t_end>100</t_end>
        <twoD>false</twoD>
    </metadata>
    <cuboids>
        <cuboid>
            <velocity>
                <x>0</x>
                <y>0</y>
                <z>0</z>
            </velocity>
            <corner>
                <x>0.6</x>
                <y>0.6</y>
                <z>0.6</z>
            </corner>
            <dimensions>
                <x>50</x>
                <y>20</y>
                <z>50</z>
            </dimensions>
            <type>1</type>
            <h>1.2</h>
            <mass>1</mass>
            <epsilon>1</epsilon>
            <sigma>1.2</sigma>
            <mv>0</mv>
        </cuboid>
        <cuboid>
            <velocity>
                <x>0</x>
                <y>0</y>
                <z>0</z>
            </velocity>
            <corner>
                <x>0.6</x>
                <y>24.6</y>
                <z>0.6</z>
            </corner>
            <dimensions>
                <x>50</x>
                <y>20</y>
                <z>50</z>
            </dimensions>
            <type>2</type>
            <h>1.2</h>
            <mass>1</mass>
            <epsilon>1</epsilon>
            <sigma>1.1</sigma>
            <mv>0.0</mv>
        </cuboid>
    </cuboids>
    <thermostat>
        <T_init>40</T_init>
        <n_thermostat>1000</n_thermostat>
    </thermostat>
</simulation>