<?xml version="1.0"?>
<simulation xmlns:xsi="http://www.w3.org/2001/XMLSchema-instance"
            xsi:noNamespaceSchemaLocation="../src/io/file/in/xml/input.xsd">
    <metadata>
        <container>
            <linkedCells>
                <domain>
                    <x>300</x>
                    <y>300</y>
                    <z>1</z>
                </domain>
                <r_cutoff>3.0</r_cutoff>
                <boundary>
                    <x_high>
                        <Outflow/>
                    </x_high>
                    <x_low>
                        <Outflow/>
                    </x_low>
                    <y_high>
                        <Outflow/>
                    </y_high>
                    <y_low>
                        <Outflow/>
                    </y_low>
                    <z_high>
                        <Outflow/>
                    </z_high>
                    <z_low>
                        <Outflow/>
                    </z_low>
                </boundary>
            </linkedCells>
        </container>
        <force>
            <LennardJones/>
        </force>
        <delta_t>0.0005</delta_t>
        <t_end>0</t_end>
        <twoD>true</twoD>
        <checkpoint>
            <name>../../input/checkpoint_membrane_test.xml</name>
            <is_membrane>true</is_membrane>
            <domain>
                <x>50</x>
                <y>50</y>
                <z>1</z>
            </domain>
        </checkpoint>
    </metadata>
</simulation>
